{
  "name": "slide-gen",
  "description": "AI-assisted presentation generation pipeline: research, outline, draft, optimize, validate graphics, generate images, and build PowerPoint files",
  "version": "1.2.0",
  "author": {
    "name": "Troy Davis",
    "email": "troy.e.davis@gmail.com"
  },
  "homepage": "https://github.com/davistroy/slide-generator",
  "repository": "https://github.com/davistroy/claude-marketplace",
  "license": "MIT",
  "keywords": ["presentation", "powerpoint", "slides", "ai", "claude", "gemini", "pipeline"]
}
