{
  "name": "bpmn-plugin",
  "description": "BPMN 2.0 workflow tools: XML generation from natural language/markdown, and conversion to Draw.io format. Includes bundled bpmn2drawio Python tool.",
  "version": "4.4.0",
  "author": {
    "name": "Troy Davis",
    "email": "troy.e.davis@gmail.com"
  },
  "homepage": "https://github.com/davistroy/claude-marketplace",
  "repository": "https://github.com/davistroy/claude-marketplace",
  "license": "MIT",
  "keywords": [
    "bpmn",
    "workflow",
    "xml",
    "diagram",
    "process-modeling",
    "drawio"
  ]
}
